Column name           ,Description,ID,Represents the unique identification of each entry,date,"Represents the date in ""yyyy-mm-dd"" format",lwarehou se_ID,IRepresents the unique identification of a warehouse,Latitude,Represents the latitude of the warehouse,Longitude,Represents the longitude of the warehouse,Product_Type,Represents the type of a product ( Type_A or Type_B),year,Represents the current year,month,Represents the current month of the year,is weekend,Represents whether the day is weekend or not,l  is_warehouse_closed,IRepresents whether the warehouse is closed or not,daily_dispatch_count,"Represents the number of items of a specific product type that are dispatched (in thousand s)
from a specific warehouse on a specific day",,,
